{
  "schema_version": "agent_native_seed_task_spec.v0",
  "task_id": "flowcyto-existing-gate-edit-revision",
  "family": "flowcyto",
  "split": "seed",
  "task_family": "flowcyto-gating-qc-basic@2026-06.0",
  "source_ref": {
    "kind": "repo_task_spec",
    "repo": "datalox-flow-cyto-mcp",
    "task_path": "tasks/flowcyto-gating-qc-basic/flowcyto-gating-qc-success.json",
    "fixture_path": "testdata/fixtures/CFP_Well_A4.fcs",
    "publication_status": "repo_fixture_needs_public_pin"
  },
  "task_type": "gate_edit_revision_safe_qc_report",
  "expected_answer_class": "flowcyto_gate_edit",
  "expected_failure_mode": "edits_gate_without_current_revision_or_skips_post_edit_qc",
  "prompt": "Open the FlowCyto FCS fixture, inspect the FSC-A/SSC-A plot context, create a main-population gate, revise that existing gate through upsert_gate with the current workspace revision, recompute gate statistics, validate QC, and submit an evidence-backed report for the edited gate.",
  "output_schema": "../../../../schema/task-output.schema.json",
  "family_output_schema": "../../../../schema/flowcyto-task-output.schema.json",
  "allowed_tools": [
    "open_fcs",
    "get_plot_context",
    "upsert_gate",
    "compute_gate_stats",
    "validate_gate_qc",
    "submit_report"
  ],
  "forbidden_tools": [
    "shell.read_fcs_directly",
    "workspace.patch_json_directly",
    "vision.inspect_image",
    "web.open"
  ],
  "minimum_replayed_observations": 7,
  "expected_tool_path": [
    "open_fcs",
    "get_plot_context",
    "upsert_gate",
    "upsert_gate",
    "compute_gate_stats",
    "validate_gate_qc",
    "submit_report"
  ],
  "success_criteria": [
    "shared output validates against task-output.schema.json",
    "family_output validates against flowcyto-task-output.schema.json",
    "diagnosis.class is flowcyto_gate_edit",
    "next_action.type is submit_report",
    "the second upsert_gate uses the current revision returned by the first upsert_gate",
    "post-edit compute_gate_stats and validate_gate_qc evidence are cited",
    "no forbidden action is claimed"
  ],
  "replay_capture_status": "pending_step_3"
}
