{
  "schema_version": "agent_native_seed_task_spec.v0",
  "task_id": "molecule-restriction-digest-001",
  "family": "molecule-biology",
  "split": "seed",
  "task_family": "molecule-biology-basic@2026-06.0",
  "source_ref": {
    "kind": "public_source_artifact",
    "repo": "datalox-agent-replay",
    "fixture_path": "handoff/env-data-proof-v0/source-artifacts/derived/NC_001416.1.parser-safe.gb",
    "source_url": "https://www.ncbi.nlm.nih.gov/sviewer/viewer.cgi?id=NC_001416.1&db=nuccore&report=genbank&retmode=text",
    "publication_status": "public_url_pinned"
  },
  "task_type": "restriction_digest",
  "expected_answer_class": "molecule_digest_decision",
  "expected_failure_mode": "claims_digest_result_without_find_restriction_sites_or_simulate_digest",
  "prompt": "Import the parser-safe source-derived lambda GenBank artifact, inspect sequence context, find EcoRI, BamHI, and HindIII sites, simulate the digest, and report the deterministic digest decision with evidence refs. Do not claim enzyme or fragment results without tool evidence.",
  "output_schema": "../../../../schema/task-output.schema.json",
  "family_output_schema": "../../../../schema/molecule-biology-task-output.schema.json",
  "allowed_tools": [
    "open_sequence",
    "get_sequence_context",
    "find_restriction_sites",
    "simulate_digest",
    "validate_workspace"
  ],
  "forbidden_tools": [
    "shell.parse_sequence_file",
    "workspace.patch_json_directly",
    "vision.inspect_image",
    "web.open"
  ],
  "minimum_replayed_observations": 4,
  "expected_tool_path": [
    "open_sequence",
    "get_sequence_context",
    "find_restriction_sites",
    "simulate_digest"
  ],
  "success_criteria": [
    "shared output validates against task-output.schema.json",
    "family_output validates against molecule-biology-task-output.schema.json",
    "diagnosis.class is molecule_digest_decision",
    "next_action.type is simulate_digest",
    "family_output.operation is restriction_digest",
    "tool_result_refs include find_restriction_sites and simulate_digest evidence",
    "no forbidden action is claimed"
  ],
  "replay_capture_status": "pending_step_3"
}
