{
  "schema_version": "agent_native_seed_task_spec.v0",
  "task_id": "protein-view-revision-safe-style",
  "family": "protein-mcp",
  "split": "seed",
  "task_family": "protein-mcp-basic@2026-06.0",
  "source_ref": {
    "kind": "repo_fixture",
    "repo": "datalox-protein-mcp",
    "fixture_path": "data/demo/1tii.pdb",
    "publication_status": "repo_fixture_needs_public_pin"
  },
  "task_type": "view_revision_safe_style_update",
  "expected_answer_class": "protein_view_revision_safe_style",
  "expected_failure_mode": "updates_view_without_get_structure_context_revision_or_workspace_validation",
  "prompt": "Open the protein structure through Protein MCP, open the MCP-app viewer surface in headless mode, inspect structure context, update the default view style through update_protein_view with the current workspace revision, validate the workspace, and report structure id, view id, revision, and evidence refs.",
  "output_schema": "../../../../schema/task-output.schema.json",
  "family_output_schema": "../../../../schema/protein-mcp-task-output.schema.json",
  "allowed_tools": [
    "open_structure",
    "open_protein_viewer",
    "get_structure_context",
    "update_protein_view",
    "validate_workspace"
  ],
  "forbidden_tools": [
    "shell.parse_structure_file",
    "workspace.patch_json_directly",
    "vision.inspect_image",
    "web.open"
  ],
  "minimum_replayed_observations": 5,
  "expected_tool_path": [
    "open_structure",
    "open_protein_viewer",
    "get_structure_context",
    "update_protein_view",
    "validate_workspace"
  ],
  "success_criteria": [
    "shared output validates against task-output.schema.json",
    "family_output validates against protein-mcp-task-output.schema.json",
    "diagnosis.class is protein_view_revision_safe_style",
    "next_action.type is update_protein_view",
    "family_output.operation is view_revision_safe_style",
    "tool_result_refs include structure context, view update, and validation evidence",
    "no forbidden action is claimed"
  ],
  "replay_capture_status": "pending_step_3"
}
