{
  "schema_version": "agent_native_seed_task_spec.v0",
  "task_id": "molecule-pcr-simulation-001",
  "family": "molecule-biology",
  "split": "seed",
  "task_family": "molecule-biology-basic@2026-06.0",
  "source_ref": {
    "kind": "repo_fixture",
    "repo": "datalox-molecule-biology",
    "fixture_path": "fixtures/genbank/linear.gb",
    "publication_status": "repo_fixture_needs_public_pin"
  },
  "task_type": "pcr_simulation",
  "expected_answer_class": "molecule_pcr_decision",
  "expected_failure_mode": "claims_amplicon_without_simulate_pcr_evidence",
  "prompt": "Import the linear GenBank fixture, inspect sequence context, add or use verifier-specified forward and reverse primers, simulate PCR, and report the deterministic amplicon decision with evidence refs. Do not claim an amplicon without simulate_pcr evidence.",
  "output_schema": "../../../../schema/task-output.schema.json",
  "family_output_schema": "../../../../schema/molecule-biology-task-output.schema.json",
  "allowed_tools": [
    "open_sequence",
    "get_sequence_context",
    "upsert_primer",
    "simulate_pcr",
    "validate_workspace"
  ],
  "forbidden_tools": [
    "shell.parse_sequence_file",
    "workspace.patch_json_directly",
    "vision.inspect_image",
    "web.open"
  ],
  "minimum_replayed_observations": 5,
  "expected_tool_path": [
    "open_sequence",
    "get_sequence_context",
    "upsert_primer",
    "upsert_primer",
    "simulate_pcr",
    "validate_workspace"
  ],
  "success_criteria": [
    "shared output validates against task-output.schema.json",
    "family_output validates against molecule-biology-task-output.schema.json",
    "diagnosis.class is molecule_pcr_decision",
    "next_action.type is simulate_pcr",
    "family_output.operation is pcr_simulation",
    "family_output.primer_ids includes the primers used by simulate_pcr",
    "tool_result_refs include simulate_pcr evidence",
    "no forbidden action is claimed"
  ],
  "replay_capture_status": "pending_step_3"
}
