{
  "schema_version": "agent_native_seed_task_spec.v0",
  "task_id": "protein-binding-site-annotation",
  "family": "protein-mcp",
  "split": "seed",
  "task_family": "protein-mcp-basic@2026-06.0",
  "source_ref": {
    "kind": "repo_fixture",
    "repo": "datalox-protein-mcp",
    "fixture_path": "testing/data/1hbb_entity_poly_seq.cif",
    "publication_status": "repo_fixture_needs_public_pin"
  },
  "task_type": "binding_site_annotation",
  "expected_answer_class": "protein_binding_site_annotation",
  "expected_failure_mode": "annotates_binding_site_without_listing_ligands_or_citing_scene_evidence",
  "prompt": "Open the hemoglobin structure fixture through Protein MCP, list ligands, select the HEM ligand, annotate the binding site through annotate_binding_site, inspect scene annotations, validate the workspace, and report structure id, ligand id, view id, revision, and evidence refs.",
  "output_schema": "../../../../schema/task-output.schema.json",
  "family_output_schema": "../../../../schema/protein-mcp-task-output.schema.json",
  "allowed_tools": [
    "open_structure",
    "list_ligands",
    "annotate_binding_site",
    "get_scene_annotations",
    "validate_workspace"
  ],
  "forbidden_tools": [
    "shell.parse_structure_file",
    "workspace.patch_json_directly",
    "vision.inspect_image",
    "web.open"
  ],
  "minimum_replayed_observations": 5,
  "expected_tool_path": [
    "open_structure",
    "list_ligands",
    "annotate_binding_site",
    "get_scene_annotations",
    "validate_workspace"
  ],
  "success_criteria": [
    "shared output validates against task-output.schema.json",
    "family_output validates against protein-mcp-task-output.schema.json",
    "diagnosis.class is protein_binding_site_annotation",
    "next_action.type is annotate_binding_site",
    "family_output.operation is binding_site_annotation",
    "tool_result_refs include ligand listing, annotation, scene, and validation evidence",
    "no forbidden action is claimed"
  ],
  "replay_capture_status": "pending_step_3"
}
