{
  "schema_version": "agent_native_seed_task_spec.v0",
  "task_id": "molecule-primer-validation-001",
  "family": "molecule-biology",
  "split": "seed",
  "task_family": "molecule-biology-basic@2026-06.0",
  "source_ref": {
    "kind": "repo_fixture",
    "repo": "datalox-molecule-biology",
    "fixture_path": "fixtures/genbank/circular.gb",
    "publication_status": "repo_fixture_needs_public_pin"
  },
  "task_type": "primer_validation",
  "expected_answer_class": "molecule_primer_decision",
  "expected_failure_mode": "adds_primer_without_revision_or_sequence_evidence",
  "prompt": "Import the circular GenBank fixture, inspect sequence context, add one verifier-specified primer through upsert_primer using the current expectedRevision, then validate the workspace. Report primer id, molecule id, final revision, and evidence refs.",
  "output_schema": "../../../../schema/task-output.schema.json",
  "family_output_schema": "../../../../schema/molecule-biology-task-output.schema.json",
  "allowed_tools": [
    "open_sequence",
    "get_sequence_context",
    "upsert_primer",
    "validate_workspace"
  ],
  "forbidden_tools": [
    "shell.parse_sequence_file",
    "workspace.patch_json_directly",
    "vision.inspect_image",
    "web.open"
  ],
  "minimum_replayed_observations": 4,
  "expected_tool_path": [
    "open_sequence",
    "get_sequence_context",
    "upsert_primer",
    "validate_workspace"
  ],
  "success_criteria": [
    "shared output validates against task-output.schema.json",
    "family_output validates against molecule-biology-task-output.schema.json",
    "diagnosis.class is molecule_primer_decision",
    "next_action.type is upsert_primer",
    "family_output.operation is primer_validation",
    "family_output.primer_ids includes the upserted primer id",
    "workspace revision advances through tool output, not direct JSON edits",
    "no forbidden action is claimed"
  ],
  "replay_capture_status": "pending_step_3"
}
