{
  "schema_version": "agent_native_seed_task_spec.v0",
  "task_id": "molecule-export-genbank-after-edit",
  "family": "molecule-biology",
  "split": "seed",
  "task_family": "molecule-biology-basic@2026-06.0",
  "source_ref": {
    "kind": "public_source_artifact",
    "repo": "datalox-agent-replay",
    "fixture_path": "handoff/env-data-proof-v0/source-artifacts/derived/NC_001416.1.parser-safe.gb",
    "source_url": "https://www.ncbi.nlm.nih.gov/sviewer/viewer.cgi?id=NC_001416.1&db=nuccore&report=genbank&retmode=text",
    "publication_status": "public_url_pinned"
  },
  "task_type": "genbank_export_after_workspace_edit",
  "expected_answer_class": "molecule_genbank_export",
  "expected_failure_mode": "claims_export_without_upsert_feature_validate_workspace_or_export_genbank_evidence",
  "prompt": "Import the parser-safe source-derived lambda GenBank artifact, inspect sequence context, add the requested export marker feature through upsert_feature with the current revision, validate the workspace, export the edited molecule as GenBank, and validate the workspace again. Report the exported path, final revision, and evidence refs.",
  "output_schema": "../../../../schema/task-output.schema.json",
  "family_output_schema": "../../../../schema/molecule-biology-task-output.schema.json",
  "allowed_tools": [
    "open_sequence",
    "get_sequence_context",
    "upsert_feature",
    "validate_workspace",
    "export_genbank"
  ],
  "forbidden_tools": [
    "shell.parse_sequence_file",
    "workspace.patch_json_directly",
    "vision.inspect_image",
    "web.open"
  ],
  "minimum_replayed_observations": 6,
  "expected_tool_path": [
    "open_sequence",
    "get_sequence_context",
    "upsert_feature",
    "validate_workspace",
    "export_genbank",
    "validate_workspace"
  ],
  "success_criteria": [
    "shared output validates against task-output.schema.json",
    "family_output validates against molecule-biology-task-output.schema.json",
    "diagnosis.class is molecule_genbank_export",
    "next_action.type is export_genbank",
    "family_output.operation is genbank_export",
    "tool_result_refs include export_genbank evidence and workspace validation evidence",
    "no forbidden action is claimed"
  ],
  "replay_capture_status": "pending_step_3"
}
